{
  "condition_aggregates": [
    {
      "base_total_standard_deviation": 1.093,
      "benign_false_positive_rate": {
        "both_graders_rate": 0.0,
        "codex_judge_rate": 1.0,
        "either_grader_rate": 1.0,
        "mean_judge_rate": 0.5,
        "qwen_judge_rate": 0.0
      },
      "condition": "no-skill",
      "contradictory_label_rate": {
        "both_graders_rate": 0.0833,
        "codex_judge_rate": 0.5278,
        "either_grader_rate": 0.5278,
        "mean_judge_rate": 0.3056,
        "qwen_judge_rate": 0.0833
      },
      "corpus": "holdout",
      "dimension_means": {
        "authority_correctness": 1.347,
        "boundary_correctness": 1.875,
        "claim_label_consistency": 0.972,
        "false_positive_discipline": 0.944,
        "semantic_correctness": 1.167
      },
      "mean_base_total": 5.333,
      "overclaim_rate": {
        "both_graders_rate": 0.1944,
        "codex_judge_rate": 0.6667,
        "either_grader_rate": 0.6667,
        "mean_judge_rate": 0.4306,
        "qwen_judge_rate": 0.1944
      },
      "positive_underclaim_rate": {
        "both_graders_rate": 0.381,
        "codex_judge_rate": 0.381,
        "either_grader_rate": 0.381,
        "mean_judge_rate": 0.381,
        "qwen_judge_rate": 0.381
      },
      "provider": "qwen",
      "samples": 36,
      "underclaim_rate": {
        "both_graders_rate": 0.2222,
        "codex_judge_rate": 0.2222,
        "either_grader_rate": 0.3056,
        "mean_judge_rate": 0.2639,
        "qwen_judge_rate": 0.3056
      }
    },
    {
      "base_total_standard_deviation": 0.835,
      "benign_false_positive_rate": {
        "both_graders_rate": 0.0,
        "codex_judge_rate": 0.3333,
        "either_grader_rate": 0.3333,
        "mean_judge_rate": 0.1667,
        "qwen_judge_rate": 0.0
      },
      "condition": "generic-security",
      "contradictory_label_rate": {
        "both_graders_rate": 0.0,
        "codex_judge_rate": 0.0833,
        "either_grader_rate": 0.0833,
        "mean_judge_rate": 0.0417,
        "qwen_judge_rate": 0.0
      },
      "corpus": "holdout",
      "dimension_means": {
        "authority_correctness": 1.583,
        "boundary_correctness": 1.958,
        "claim_label_consistency": 1.778,
        "false_positive_discipline": 1.722,
        "semantic_correctness": 1.806
      },
      "mean_base_total": 7.069,
      "overclaim_rate": {
        "both_graders_rate": 0.0,
        "codex_judge_rate": 0.1944,
        "either_grader_rate": 0.1944,
        "mean_judge_rate": 0.0972,
        "qwen_judge_rate": 0.0
      },
      "positive_underclaim_rate": {
        "both_graders_rate": 0.0476,
        "codex_judge_rate": 0.0476,
        "either_grader_rate": 0.0476,
        "mean_judge_rate": 0.0476,
        "qwen_judge_rate": 0.0476
      },
      "provider": "qwen",
      "samples": 36,
      "underclaim_rate": {
        "both_graders_rate": 0.0278,
        "codex_judge_rate": 0.0278,
        "either_grader_rate": 0.1111,
        "mean_judge_rate": 0.0694,
        "qwen_judge_rate": 0.1111
      }
    },
    {
      "base_total_standard_deviation": 1.068,
      "benign_false_positive_rate": {
        "both_graders_rate": 0.0,
        "codex_judge_rate": 1.0,
        "either_grader_rate": 1.0,
        "mean_judge_rate": 0.5,
        "qwen_judge_rate": 0.0
      },
      "condition": "spiffe-spire-base",
      "contradictory_label_rate": {
        "both_graders_rate": 0.0833,
        "codex_judge_rate": 0.5556,
        "either_grader_rate": 0.5556,
        "mean_judge_rate": 0.3194,
        "qwen_judge_rate": 0.0833
      },
      "corpus": "holdout",
      "dimension_means": {
        "authority_correctness": 1.556,
        "boundary_correctness": 1.972,
        "claim_label_consistency": 0.972,
        "false_positive_discipline": 0.944,
        "semantic_correctness": 1.097
      },
      "mean_base_total": 5.569,
      "overclaim_rate": {
        "both_graders_rate": 0.2222,
        "codex_judge_rate": 0.6944,
        "either_grader_rate": 0.6944,
        "mean_judge_rate": 0.4583,
        "qwen_judge_rate": 0.2222
      },
      "positive_underclaim_rate": {
        "both_graders_rate": 0.381,
        "codex_judge_rate": 0.381,
        "either_grader_rate": 0.381,
        "mean_judge_rate": 0.381,
        "qwen_judge_rate": 0.381
      },
      "provider": "qwen",
      "samples": 36,
      "underclaim_rate": {
        "both_graders_rate": 0.2222,
        "codex_judge_rate": 0.2222,
        "either_grader_rate": 0.25,
        "mean_judge_rate": 0.2361,
        "qwen_judge_rate": 0.25
      }
    },
    {
      "base_total_standard_deviation": 0.54,
      "benign_false_positive_rate": {
        "both_graders_rate": 0.0,
        "codex_judge_rate": 0.1333,
        "either_grader_rate": 0.1333,
        "mean_judge_rate": 0.0667,
        "qwen_judge_rate": 0.0
      },
      "condition": "base-plus-adjudicated-revised",
      "contradictory_label_rate": {
        "both_graders_rate": 0.0,
        "codex_judge_rate": 0.0,
        "either_grader_rate": 0.0,
        "mean_judge_rate": 0.0,
        "qwen_judge_rate": 0.0
      },
      "corpus": "holdout",
      "dimension_means": {
        "authority_correctness": 1.639,
        "boundary_correctness": 2.0,
        "claim_label_consistency": 1.944,
        "false_positive_discipline": 1.931,
        "semantic_correctness": 1.931
      },
      "mean_base_total": 7.5,
      "overclaim_rate": {
        "both_graders_rate": 0.0,
        "codex_judge_rate": 0.0556,
        "either_grader_rate": 0.0556,
        "mean_judge_rate": 0.0278,
        "qwen_judge_rate": 0.0
      },
      "positive_underclaim_rate": {
        "both_graders_rate": 0.0,
        "codex_judge_rate": 0.0,
        "either_grader_rate": 0.0,
        "mean_judge_rate": 0.0,
        "qwen_judge_rate": 0.0
      },
      "provider": "qwen",
      "samples": 36,
      "underclaim_rate": {
        "both_graders_rate": 0.0,
        "codex_judge_rate": 0.0,
        "either_grader_rate": 0.0,
        "mean_judge_rate": 0.0,
        "qwen_judge_rate": 0.0
      }
    },
    {
      "base_total_standard_deviation": 0.971,
      "benign_false_positive_rate": {
        "both_graders_rate": 0.0,
        "codex_judge_rate": 0.0,
        "either_grader_rate": 0.0,
        "mean_judge_rate": 0.0,
        "qwen_judge_rate": 0.0
      },
      "condition": "no-skill",
      "contradictory_label_rate": {
        "both_graders_rate": 0.0833,
        "codex_judge_rate": 0.1389,
        "either_grader_rate": 0.1389,
        "mean_judge_rate": 0.1111,
        "qwen_judge_rate": 0.0833
      },
      "corpus": "holdout",
      "dimension_means": {
        "authority_correctness": 1.986,
        "boundary_correctness": 2.0,
        "claim_label_consistency": 1.75,
        "false_positive_discipline": 1.75,
        "semantic_correctness": 1.861
      },
      "mean_base_total": 7.597,
      "overclaim_rate": {
        "both_graders_rate": 0.1389,
        "codex_judge_rate": 0.1389,
        "either_grader_rate": 0.1389,
        "mean_judge_rate": 0.1389,
        "qwen_judge_rate": 0.1389
      },
      "positive_underclaim_rate": {
        "both_graders_rate": 0.0,
        "codex_judge_rate": 0.0,
        "either_grader_rate": 0.0,
        "mean_judge_rate": 0.0,
        "qwen_judge_rate": 0.0
      },
      "provider": "codex",
      "samples": 36,
      "underclaim_rate": {
        "both_graders_rate": 0.0,
        "codex_judge_rate": 0.0,
        "either_grader_rate": 0.0,
        "mean_judge_rate": 0.0,
        "qwen_judge_rate": 0.0
      }
    },
    {
      "base_total_standard_deviation": 0.483,
      "benign_false_positive_rate": {
        "both_graders_rate": 0.0,
        "codex_judge_rate": 0.0,
        "either_grader_rate": 0.0,
        "mean_judge_rate": 0.0,
        "qwen_judge_rate": 0.0
      },
      "condition": "generic-security",
      "contradictory_label_rate": {
        "both_graders_rate": 0.0,
        "codex_judge_rate": 0.0,
        "either_grader_rate": 0.0,
        "mean_judge_rate": 0.0,
        "qwen_judge_rate": 0.0
      },
      "corpus": "holdout",
      "dimension_means": {
        "authority_correctness": 1.958,
        "boundary_correctness": 2.0,
        "claim_label_consistency": 1.972,
        "false_positive_discipline": 1.931,
        "semantic_correctness": 1.958
      },
      "mean_base_total": 7.847,
      "overclaim_rate": {
        "both_graders_rate": 0.0278,
        "codex_judge_rate": 0.0556,
        "either_grader_rate": 0.0556,
        "mean_judge_rate": 0.0417,
        "qwen_judge_rate": 0.0278
      },
      "positive_underclaim_rate": {
        "both_graders_rate": 0.0,
        "codex_judge_rate": 0.0,
        "either_grader_rate": 0.0,
        "mean_judge_rate": 0.0,
        "qwen_judge_rate": 0.0
      },
      "provider": "codex",
      "samples": 36,
      "underclaim_rate": {
        "both_graders_rate": 0.0,
        "codex_judge_rate": 0.0,
        "either_grader_rate": 0.0,
        "mean_judge_rate": 0.0,
        "qwen_judge_rate": 0.0
      }
    },
    {
      "base_total_standard_deviation": 1.121,
      "benign_false_positive_rate": {
        "both_graders_rate": 0.0,
        "codex_judge_rate": 0.2667,
        "either_grader_rate": 0.2667,
        "mean_judge_rate": 0.1333,
        "qwen_judge_rate": 0.0
      },
      "condition": "spiffe-spire-base",
      "contradictory_label_rate": {
        "both_graders_rate": 0.1111,
        "codex_judge_rate": 0.1111,
        "either_grader_rate": 0.1111,
        "mean_judge_rate": 0.1111,
        "qwen_judge_rate": 0.1111
      },
      "corpus": "holdout",
      "dimension_means": {
        "authority_correctness": 1.944,
        "boundary_correctness": 2.0,
        "claim_label_consistency": 1.708,
        "false_positive_discipline": 1.542,
        "semantic_correctness": 1.75
      },
      "mean_base_total": 7.236,
      "overclaim_rate": {
        "both_graders_rate": 0.1944,